[
  {
    "id": "SRC-005F5D1A",
    "label": "DK Engineering — dealer listing",
    "publisher": "DK Engineering",
    "description": "dealer listing",
    "url": "https://www.dkeng.co.uk/ferrari-sales/2400/blue_chip_competition_cars/ferrari_daytona_sp3.html"
  },
  {
    "id": "SRC-00E16A77",
    "label": "Autogespot — Monaco full-black SP3 sighting",
    "publisher": "Autogespot",
    "description": "Monaco full-black SP3 sighting",
    "url": "https://www.autogespot.com/ferrari-daytona-sp3/2026/02/25"
  },
  {
    "id": "SRC-019889B3",
    "label": "YAUTO.cz — Czech Ministry-derived VIN and registration record",
    "publisher": "YAUTO.cz",
    "description": "Czech Ministry-derived VIN and registration record",
    "url": "https://yauto.cz/vin/ZFF05UMB000298816/podrobne/"
  },
  {
    "id": "SRC-055BAC0E",
    "label": "The Times — Sainz discusses his collection",
    "publisher": "The Times",
    "description": "Sainz discusses his collection",
    "url": "https://www.thetimes.com/life-style/driving/article/carlos-sainz-jr-formula-one-williams-cars-mp5j6mzss"
  },
  {
    "id": "SRC-05A20C79",
    "label": "duPont REGISTRY — Piero Ferrari livery feature",
    "publisher": "duPont REGISTRY",
    "description": "Piero Ferrari livery feature",
    "url": "https://news.dupontregistry.com/blogs/ferrari-news/piero-ferrari-daytona-sp3-livery"
  },
  {
    "id": "SRC-066F35CE",
    "label": "Exclusive Car Registry — public profile",
    "publisher": "Exclusive Car Registry",
    "description": "public profile",
    "url": "https://exclusivecarregistry.com/details/ferrari/daytona-sp3/74185"
  },
  {
    "id": "SRC-06CEDC07",
    "label": "AutoWeek — Dutch plate HJK-99-H vehicle check",
    "publisher": "AutoWeek",
    "description": "Dutch plate HJK-99-H vehicle check",
    "url": "https://www.autoweek.nl/kentekencheck/HJK-99-H/"
  },
  {
    "id": "SRC-087E0132",
    "label": "Goodwood Road & Racing — 2022 supercar debut preview",
    "publisher": "Goodwood Road & Racing",
    "description": "2022 supercar debut preview",
    "url": "https://api.goodwood.com/grr/event-coverage/festival-of-speed/supercar-debuts-announced-for-fos-2022/"
  },
  {
    "id": "SRC-0966E50D",
    "label": "Dutch Ferrari and Lamborghini Register — chassis 291270 photo record",
    "publisher": "Dutch Ferrari and Lamborghini Register",
    "description": "chassis 291270 photo record",
    "url": "https://onlybullsandhorses.com/welcome/ferrari/stradali-moderni/monza-daytona/daytona-sp3/zff05umb000291270/"
  },
  {
    "id": "SRC-099BEEBE",
    "label": "VINinspect — Daytona SP3 model index; search-index evidence",
    "publisher": "VINinspect",
    "description": "Daytona SP3 model index; search-index evidence",
    "url": "https://vininspect.com/ru/vin/ferrari/daytona-sp3"
  },
  {
    "id": "SRC-0AC80516",
    "label": "Collectors Car World — Ferrari report on MP3",
    "publisher": "Collectors Car World",
    "description": "Ferrari report on MP3",
    "url": "https://collectorscarworld.com/the-daytona-sp3-mulotype/"
  },
  {
    "id": "SRC-0B9A6540",
    "label": "duPont REGISTRY — Miller Motorcars feature",
    "publisher": "duPont REGISTRY",
    "description": "Miller Motorcars feature",
    "url": "https://news.dupontregistry.com/blogs/daytona-sp3/miller-motorcars-ferrari-daytona-sp3"
  },
  {
    "id": "SRC-0CB7FEB7",
    "label": "Hendrick Performance — dealer listing",
    "publisher": "Hendrick Performance",
    "description": "dealer listing",
    "url": "https://www.hendrickcars.com/used/Ferrari/2024-Ferrari-SP3-Daytona-47f672b3ac185c30e41528d4e9c75245.htm"
  },
  {
    "id": "SRC-0D04C60C",
    "label": "Carrio Motor Cars — dealer listing",
    "publisher": "Carrio Motor Cars",
    "description": "dealer listing",
    "url": "https://www.carriomotorcars.com/2023-ferrari-daytona-sp3-fort-lauderdale-fl?isNew=0"
  },
  {
    "id": "SRC-0E4D6FB3",
    "label": "AutoWeek — Dutch plate JKF-62-L vehicle check",
    "publisher": "AutoWeek",
    "description": "Dutch plate JKF-62-L vehicle check",
    "url": "https://www.autoweek.nl/kentekencheck/JKF-62-L/"
  },
  {
    "id": "SRC-0F861831",
    "label": "duPont REGISTRY — David Lee collector profile",
    "publisher": "duPont REGISTRY",
    "description": "David Lee collector profile",
    "url": "https://news.dupontregistry.com/blogs/ferrari-news/ferrari-collector-david-lee-takes-delivery-of-his-green-carbon-daytona-sp3"
  },
  {
    "id": "SRC-1232FBC2",
    "label": "duPont REGISTRY — Protective Film Solutions / XPEL feature",
    "publisher": "duPont REGISTRY",
    "description": "Protective Film Solutions / XPEL feature",
    "url": "https://news.dupontregistry.com/blogs/sponsored/preserving-a-modern-icon-ferrari-daytona-sp3-protected-by-xpel"
  },
  {
    "id": "SRC-1294B4FE",
    "label": "Cobra Magazine — Cavalcade 2026 Daytona SP3 collision report",
    "publisher": "Cobra Magazine",
    "description": "Cavalcade 2026 Daytona SP3 collision report",
    "url": "https://cobramagazine.com/5-million-ferrari-daytona-sp3-crashed-during-ferrari-cavalcade-2026/"
  },
  {
    "id": "SRC-13F11D8A",
    "label": "Made in Maranello — Daytona SP3 chassis index",
    "publisher": "Made in Maranello",
    "description": "Daytona SP3 chassis index",
    "url": "https://made-in-maranello.fr/en/model/ferrari-daytona-sp3"
  },
  {
    "id": "SRC-144DC317",
    "label": "duPont REGISTRY — Ferrari Beverly Hills gallery (@paid2shoot)",
    "publisher": "duPont REGISTRY",
    "description": "Ferrari Beverly Hills gallery (@paid2shoot)",
    "url": "https://news.dupontregistry.com/blogs/ferrari-news/ferrari-beverly-hills-shows-off-a-stunning-ferrari-daytona-sp3-spec"
  },
  {
    "id": "SRC-15067232",
    "label": "Anamera — Ferrari Finali Mondiali 2023 chassis list",
    "publisher": "Anamera",
    "description": "Ferrari Finali Mondiali 2023 chassis list",
    "url": "https://www.finecars.cc/en/editorial/article/news/ferrari-finali-mondiali-2023-returns-to-mugello-for-highly-successful-event/index.html"
  },
  {
    "id": "SRC-1558DB85",
    "label": "Top Gear Spain — NOVITEC Daytona SP3 photo gallery",
    "publisher": "Top Gear Spain",
    "description": "Public studio gallery dated 16 February 2026, credited to philipprupprecht.",
    "url": "https://www.topgear.es/deportivos/galeria-ferrari-daytona-sp3-novitec_6934766_1.html",
    "accessed": "2026-10-07"
  },
  {
    "id": "SRC-16E30660",
    "label": "Znews — Gordon Ramsay London photo gallery",
    "publisher": "Znews",
    "description": "Gordon Ramsay London photo gallery",
    "url": "https://znews.vn/can-canh-sieu-xe-ferrari-daytona-sp3-cua-dau-bep-gordon-ramsay-post1542994.html"
  },
  {
    "id": "SRC-17A29963",
    "label": "RM Sotheby’s — London 2026 chassis 277499 catalogue",
    "publisher": "RM Sotheby’s",
    "description": "London 2026 catalogue: development car 277499, VIN, mileage, history, estimate and photography",
    "url": "https://rmsothebys.com/auctions/lf26/lots/r0063-2022-ferrari-daytona-sp3/"
  },
  {
    "id": "SRC-1C168574",
    "label": "duPont REGISTRY — 2026 Steven Victor collection update",
    "publisher": "duPont REGISTRY",
    "description": "2026 Steven Victor collection update",
    "url": "https://news.dupontregistry.com/blogs/news/steven-victors-love-for-cars-inspires-his-newest-nike-af1-collaboration"
  },
  {
    "id": "SRC-1D974B7B",
    "label": "Țiriac Collection — collection announcement",
    "publisher": "Țiriac Collection",
    "description": "collection announcement",
    "url": "https://tiriaccollection.ro/noutati/articol/iconicul-exemplar-ferrari-daytona-sp3-devine-cel-mai-nou-exponat-al-galeriei-tiriac-collection"
  },
  {
    "id": "SRC-1EBA6BCB",
    "label": "YAUTO.cz — Czech Ministry-derived record for VIN ZFF05UMB000272367",
    "publisher": "YAUTO.cz",
    "description": "Czech Ministry-derived record for VIN ZFF05UMB000272367",
    "url": "https://yauto.cz/vin/ZFF05UMB000272367/podrobne/"
  },
  {
    "id": "SRC-1F622285",
    "label": "Cavallino — Issue 261 test-drive contents",
    "publisher": "Cavallino",
    "description": "Issue 261 test-drive contents",
    "url": "https://cavallino.com/products/cavallino-261"
  },
  {
    "id": "SRC-1FDC5C1F",
    "label": "Carup — Swedish Daytona SP3 owners",
    "publisher": "Carup",
    "description": "Swedish Daytona SP3 owners",
    "url": "https://carup.se/svenska-miljardarer-fick-kopa-likadan-ferrari-som-zlatan-och-gessle/"
  },
  {
    "id": "SRC-21E1A294",
    "label": "F1rst Motors — dealer’s own article",
    "publisher": "F1rst Motors",
    "description": "dealer’s own article",
    "url": "https://f1rstmotors.com/news/our-daytona-sp3-is-signed-by-leclerc-and-sainz"
  },
  {
    "id": "SRC-22FB310C",
    "label": "Hotel Tylösand — collection description",
    "publisher": "Hotel Tylösand",
    "description": "collection description",
    "url": "https://www.tylosand.se/ferrari-exhibition/history-cars-technology"
  },
  {
    "id": "SRC-2395212A",
    "label": "LIKE A G — Monaco driving video",
    "publisher": "LIKE A G",
    "description": "Monaco driving video",
    "url": "https://www.youtube.com/watch?v=orsRwI25t-Q"
  },
  {
    "id": "SRC-250CCA7F",
    "label": "Ultimatecarpage — chassis record",
    "publisher": "Ultimatecarpage",
    "description": "chassis record",
    "url": "https://www.ultimatecarpage.com/chassis/4941/Ferrari-Daytona-SP3-286921.html"
  },
  {
    "id": "SRC-25872DB5",
    "label": "duPont REGISTRY — Sainz delivery",
    "publisher": "duPont REGISTRY",
    "description": "Sainz delivery",
    "url": "https://news.dupontregistry.com/blogs/ferrari-news/carlos-sainz-jr-delivery-of-his-new-3m-daytona-sp3"
  },
  {
    "id": "SRC-258B8C9F",
    "label": "Exclusive Car Registry — public profile",
    "publisher": "Exclusive Car Registry",
    "description": "public profile",
    "url": "https://exclusivecarregistry.com/details/ferrari/daytona-sp3/100373"
  },
  {
    "id": "SRC-26297BB9",